Question	Answer	Source
Which color does Lukes lightsaber has in Episode IV	Luke Skywalker has a green lightsaber in Episode IV	Editorial
When is the starwars day?	The Star Wars day is on may the fourth	Editorial
which color has lukes lightsaber in episode V?	Luke Skywalker has a red lightsaber in Episode V	Editorial
what is the ranking of the starwars movies?	This is a komplex question...  \nThe ranking is as follows:  \n - Episode IV: A New Hope  \n - Episode V: The Empire Strikes Back  \n - Episode VIII: The Last Jedi  \n - Rogue One: A Star Wars Story  \n - Episode VI: Return of the Jedi  \n - Episode VII: The Force Awakens  \n - Episode I: The Phantom Menace  \n - Episode III: Revenge of the Sith  \n - Episode II: Attack of the Clones	Editorial
Do you know a good yoda quote?	“Do. Or do not. There is no try.” The Empire Strikes Back	Editorial
Who is the best pilot in the universe?	Anikin skywalker	Editorial
